{
  "id": "grassland-base",
  "title": "GRASSLAND BASE",
  "subtitle": "草原基地 —— DeWorld最早的出发点",
  "archiveId": "AZ-LOC-003",
  "clearance": "L3",
  "lastUpdated": "2026-08-19",
  "tags": ["地点", "草原基地", "GRASSLAND BASE", "L3"],
  "contentFile": "pages/grassland-base.md",
  "banner": {
    "level": "L3",
    "text": "该文档需 L3 及以上保密权限访问。",
    "meta": "EPUN-WAR-ARCH\nSERIES AZ-LOC",
    "color": "amber"
  },
  "infobox": {
    "title": "Territory Profile",
    "fields": [
      { "label": "编号", "auto": "archiveId" },
      { "label": "别名", "value": "草原基地 / GRASSLAND BASE" },
      { "label": "状态", "value": "<span class='highlight'>活动</span>" },
      { "label": "形成日期", "value": "2028年5月" },
      { "label": "状态", "value": "非关键重要节点" }
    ]
  },
  "categories": ["entities", "locations"],
  "relations": {
    "parent": "efgh",
    "subordinates": [],
    "associates": [
      { "id": "deworld", "type": "名义上属", "description": "战区的缔造者，现已转入地下" },
      { "id": "efgh", "type": "旧主", "description": "原本上属"},
      { "id": "epun", "type": "外围封锁方", "description": ""}
    ]
  },
  "autoGenerate": {
    "breadcrumb": true,
    "categoryNav": true,
    "relatedPages": true
  },
  "metadata": {
    "author": "EPUN战档司 · 战区测绘处",
    "reviewer": "L3审核员",
    "version": "1.0.0"
  }
}